{
  "artifactId": "corpus-statistics-v0.1",
  "artifactVersion": "0.1.0",
  "characterFrequency": {
    "A": 731203,
    "B": 139846,
    "C": 185849,
    "D": 400494,
    "E": 1119617,
    "F": 209239,
    "G": 172048,
    "H": 650743,
    "I": 577691,
    "J": 15946,
    "K": 66676,
    "L": 375313,
    "M": 230032,
    "N": 615091,
    "O": 678136,
    "P": 136173,
    "Q": 7552,
    "R": 502402,
    "S": 556863,
    "T": 827161,
    "U": 252211,
    "V": 83829,
    "W": 201292,
    "X": 9160,
    "Y": 176040,
    "Z": 5525
  },
  "crossWordBoundaryBigrams": {
    "AA": 1390,
    "AB": 2245,
    "AC": 3168,
    "AD": 1843,
    "AE": 91,
    "AF": 2737,
    "AG": 2423,
    "AH": 1637,
    "AI": 460,
    "AJ": 226,
    "AK": 400,
    "AL": 2941,
    "AM": 3432,
    "AN": 861,
    "AO": 457,
    "AP": 2644,
    "AQ": 219,
    "AR": 1354,
    "AS": 5301,
    "AT": 2820,
    "AU": 100,
    "AV": 1257,
    "AW": 2653,
    "AY": 361,
    "AZ": 8,
    "BA": 652,
    "BB": 115,
    "BC": 84,
    "BD": 62,
    "BE": 36,
    "BF": 103,
    "BG": 33,
    "BH": 177,
    "BI": 149,
    "BJ": 9,
    "BK": 36,
    "BL": 51,
    "BM": 56,
    "BN": 52,
    "BO": 168,
    "BP": 29,
    "BQ": 4,
    "BR": 51,
    "BS": 292,
    "BT": 432,
    "BU": 26,
    "BV": 9,
    "BW": 222,
    "BY": 24,
    "BZ": 1,
    "CA": 300,
    "CB": 90,
    "CC": 102,
    "CD": 68,
    "CE": 42,
    "CF": 73,
    "CG": 46,
    "CH": 105,
    "CI": 108,
    "CJ": 10,
    "CK": 6,
    "CL": 53,
    "CM": 79,
    "CN": 22,
    "CO": 107,
    "CP": 80,
    "CQ": 1,
    "CR": 45,
    "CS": 195,
    "CT": 152,
    "CU": 9,
    "CV": 20,
    "CW": 125,
    "CY": 11,
    "CZ": 2,
    "DA": 30368,
    "DB": 14912,
    "DC": 6686,
    "DD": 5508,
    "DE": 4854,
    "DF": 10169,
    "DG": 4406,
    "DH": 21105,
    "DI": 18234,
    "DJ": 2283,
    "DK": 938,
    "DL": 5344,
    "DM": 9901,
    "DN": 8669,
    "DO": 14505,
    "DP": 4989,
    "DQ": 368,
    "DR": 3693,
    "DS": 18980,
    "DT": 49354,
    "DU": 6144,
    "DV": 1137,
    "DW": 15985,
    "DX": 3,
    "DY": 3555,
    "DZ": 217,
    "EA": 39834,
    "EB": 18300,
    "EC": 21045,
    "ED": 12978,
    "EE": 9782,
    "EF": 17691,
    "EG": 9585,
    "EH": 27029,
    "EI": 21411,
    "EJ": 2038,
    "EK": 4465,
    "EL": 19292,
    "EM": 18894,
    "EN": 9897,
    "EO": 25626,
    "EP": 15303,
    "EQ": 927,
    "ER": 9036,
    "ES": 39498,
    "ET": 48211,
    "EU": 5830,
    "EV": 3359,
    "EW": 31442,
    "EX": 1,
    "EY": 5889,
    "EZ": 88,
    "FA": 7939,
    "FB": 2503,
    "FC": 2096,
    "FD": 1582,
    "FE": 2029,
    "FF": 1738,
    "FG": 2572,
    "FH": 7561,
    "FI": 5282,
    "FJ": 1910,
    "FK": 337,
    "FL": 1382,
    "FM": 4527,
    "FN": 1051,
    "FO": 1992,
    "FP": 1667,
    "FQ": 59,
    "FR": 1030,
    "FS": 4294,
    "FT": 28145,
    "FU": 607,
    "FV": 358,
    "FW": 2594,
    "FX": 1,
    "FY": 2082,
    "FZ": 317,
    "GA": 7804,
    "GB": 2217,
    "GC": 1280,
    "GD": 1123,
    "GE": 1083,
    "GF": 2236,
    "GG": 733,
    "GH": 3743,
    "GI": 3901,
    "GJ": 181,
    "GK": 140,
    "GL": 1316,
    "GM": 2206,
    "GN": 808,
    "GO": 5111,
    "GP": 1069,
    "GQ": 115,
    "GR": 913,
    "GS": 3405,
    "GT": 11338,
    "GU": 1332,
    "GV": 365,
    "GW": 3031,
    "GY": 860,
    "GZ": 14,
    "HA": 12067,
    "HB": 2446,
    "HC": 1841,
    "HD": 1604,
    "HE": 1142,
    "HF": 2318,
    "HG": 1251,
    "HH": 6367,
    "HI": 4926,
    "HJ": 357,
    "HK": 361,
    "HL": 1132,
    "HM": 3329,
    "HN": 1422,
    "HO": 3810,
    "HP": 1548,
    "HQ": 75,
    "HR": 934,
    "HS": 4625,
    "HT": 14296,
    "HU": 1302,
    "HV": 310,
    "HW": 4256,
    "HY": 1574,
    "HZ": 34,
    "IA": 3628,
    "IB": 944,
    "IC": 2112,
    "ID": 1969,
    "IE": 267,
    "IF": 680,
    "IG": 563,
    "IH": 3934,
    "II": 207,
    "IJ": 47,
    "IK": 924,
    "IL": 626,
    "IM": 1391,
    "IN": 518,
    "IO": 356,
    "IP": 734,
    "IQ": 29,
    "IR": 484,
    "IS": 4050,
    "IT": 1992,
    "IU": 158,
    "IV": 46,
    "IW": 4765,
    "IY": 49,
    "IZ": 5,
    "JA": 6,
    "JF": 1,
    "JG": 1,
    "JH": 2,
    "JM": 1,
    "JP": 1,
    "JT": 1,
    "JW": 1,
    "KA": 2897,
    "KB": 704,
    "KC": 527,
    "KD": 274,
    "KE": 209,
    "KF": 625,
    "KG": 161,
    "KH": 1113,
    "KI": 1426,
    "KJ": 50,
    "KK": 48,
    "KL": 271,
    "KM": 502,
    "KN": 330,
    "KO": 2311,
    "KP": 269,
    "KQ": 19,
    "KR": 176,
    "KS": 794,
    "KT": 2748,
    "KU": 485,
    "KV": 76,
    "KW": 1082,
    "KX": 28,
    "KY": 510,
    "KZ": 8,
    "LA": 6734,
    "LB": 6268,
    "LC": 2637,
    "LD": 1999,
    "LE": 1217,
    "LF": 2219,
    "LG": 1383,
    "LH": 3873,
    "LI": 4105,
    "LJ": 286,
    "LK": 555,
    "LL": 1283,
    "LM": 2531,
    "LN": 2663,
    "LO": 3637,
    "LP": 1670,
    "LQ": 70,
    "LR": 1414,
    "LS": 4971,
    "LT": 12952,
    "LU": 749,
    "LV": 298,
    "LW": 3275,
    "LY": 1439,
    "LZ": 8,
    "MA": 8431,
    "MB": 2091,
    "MC": 846,
    "MD": 745,
    "ME": 645,
    "MF": 1638,
    "MG": 687,
    "MH": 2771,
    "MI": 2978,
    "MJ": 213,
    "MK": 163,
    "ML": 597,
    "MM": 1247,
    "MN": 1074,
    "MO": 2355,
    "MP": 534,
    "MQ": 80,
    "MR": 480,
    "MS": 2784,
    "MT": 10258,
    "MU": 748,
    "MV": 211,
    "MW": 3150,
    "MY": 507,
    "MZ": 19,
    "NA": 20814,
    "NB": 5047,
    "NC": 3354,
    "ND": 2570,
    "NE": 3568,
    "NF": 4452,
    "NG": 1651,
    "NH": 12465,
    "NI": 9357,
    "NJ": 886,
    "NK": 479,
    "NL": 2318,
    "NM": 5125,
    "NN": 1527,
    "NO": 12084,
    "NP": 2680,
    "NQ": 198,
    "NR": 1713,
    "NS": 8656,
    "NT": 36636,
    "NU": 2526,
    "NV": 711,
    "NW": 8472,
    "NX": 1,
    "NY": 2317,
    "NZ": 73,
    "OA": 6380,
    "OB": 6296,
    "OC": 3287,
    "OD": 3903,
    "OE": 2056,
    "OF": 2586,
    "OG": 2639,
    "OH": 9009,
    "OI": 3360,
    "OJ": 966,
    "OK": 1005,
    "OL": 2913,
    "OM": 7551,
    "ON": 1911,
    "OO": 2212,
    "OP": 3176,
    "OQ": 148,
    "OR": 1952,
    "OS": 7397,
    "OT": 18939,
    "OU": 1097,
    "OV": 499,
    "OW": 3981,
    "OY": 2751,
    "OZ": 89,
    "PA": 2094,
    "PB": 385,
    "PC": 172,
    "PD": 147,
    "PE": 136,
    "PF": 500,
    "PG": 78,
    "PH": 710,
    "PI": 932,
    "PJ": 39,
    "PK": 25,
    "PL": 159,
    "PM": 361,
    "PN": 141,
    "PO": 1085,
    "PP": 106,
    "PQ": 17,
    "PR": 85,
    "PS": 533,
    "PT": 2355,
    "PU": 208,
    "PV": 25,
    "PW": 642,
    "PX": 1,
    "PY": 166,
    "PZ": 3,
    "QA": 1,
    "QG": 1,
    "QO": 2,
    "QW": 3,
    "RA": 15094,
    "RB": 5358,
    "RC": 4184,
    "RD": 2891,
    "RE": 3427,
    "RF": 5738,
    "RG": 2401,
    "RH": 9064,
    "RI": 7473,
    "RJ": 743,
    "RK": 608,
    "RL": 2894,
    "RM": 5571,
    "RN": 2093,
    "RO": 7915,
    "RP": 3141,
    "RQ": 187,
    "RR": 1867,
    "RS": 9222,
    "RT": 20385,
    "RU": 1382,
    "RV": 793,
    "RW": 7589,
    "RX": 37,
    "RY": 2086,
    "RZ": 26,
    "SA": 32308,
    "SB": 9263,
    "SC": 7216,
    "SD": 4939,
    "SE": 3881,
    "SF": 9083,
    "SG": 3596,
    "SH": 11351,
    "SI": 13020,
    "SJ": 862,
    "SK": 781,
    "SL": 4374,
    "SM": 7435,
    "SN": 6985,
    "SO": 20376,
    "SP": 5085,
    "SQ": 501,
    "SR": 3362,
    "SS": 15503,
    "ST": 26921,
    "SU": 2534,
    "SV": 1613,
    "SW": 14295,
    "SX": 3,
    "SY": 2169,
    "SZ": 49,
    "TA": 22630,
    "TB": 9722,
    "TC": 5794,
    "TD": 5656,
    "TE": 3687,
    "TF": 7222,
    "TG": 2771,
    "TH": 15740,
    "TI": 20010,
    "TJ": 1020,
    "TK": 1270,
    "TL": 4655,
    "TM": 8113,
    "TN": 4801,
    "TO": 16807,
    "TP": 3916,
    "TQ": 314,
    "TR": 2948,
    "TS": 14284,
    "TT": 34081,
    "TU": 3863,
    "TV": 902,
    "TW": 16259,
    "TX": 1,
    "TY": 4022,
    "TZ": 59,
    "UA": 3110,
    "UB": 866,
    "UC": 1002,
    "UD": 928,
    "UE": 299,
    "UF": 659,
    "UG": 426,
    "UH": 1993,
    "UI": 761,
    "UJ": 71,
    "UK": 798,
    "UL": 474,
    "UM": 1502,
    "UN": 556,
    "UO": 619,
    "UP": 392,
    "UQ": 29,
    "UR": 343,
    "US": 3308,
    "UT": 2059,
    "UU": 192,
    "UV": 67,
    "UW": 2090,
    "UX": 1,
    "UY": 213,
    "UZ": 3,
    "VA": 7,
    "VB": 1,
    "VE": 2,
    "VG": 1,
    "VH": 3,
    "VI": 2,
    "VK": 1,
    "VL": 2,
    "VM": 2,
    "VN": 1,
    "VO": 1,
    "VP": 2,
    "VR": 1,
    "VS": 4,
    "VT": 10,
    "VW": 2,
    "WA": 2232,
    "WB": 781,
    "WC": 694,
    "WD": 567,
    "WE": 292,
    "WF": 650,
    "WG": 257,
    "WH": 1640,
    "WI": 1872,
    "WJ": 107,
    "WK": 53,
    "WL": 488,
    "WM": 1156,
    "WN": 692,
    "WO": 1155,
    "WP": 351,
    "WQ": 40,
    "WR": 250,
    "WS": 1327,
    "WT": 4258,
    "WU": 268,
    "WV": 145,
    "WW": 1601,
    "WY": 519,
    "WZ": 13,
    "XA": 172,
    "XB": 46,
    "XC": 52,
    "XD": 52,
    "XE": 11,
    "XF": 48,
    "XG": 19,
    "XH": 149,
    "XI": 77,
    "XJ": 4,
    "XK": 5,
    "XL": 30,
    "XM": 78,
    "XN": 19,
    "XO": 115,
    "XP": 24,
    "XQ": 2,
    "XR": 13,
    "XS": 84,
    "XT": 138,
    "XU": 9,
    "XV": 3,
    "XW": 119,
    "XY": 38,
    "YA": 12805,
    "YB": 6149,
    "YC": 4907,
    "YD": 4315,
    "YE": 2129,
    "YF": 5567,
    "YG": 2989,
    "YH": 6999,
    "YI": 5331,
    "YJ": 513,
    "YK": 790,
    "YL": 3780,
    "YM": 5729,
    "YN": 2454,
    "YO": 7471,
    "YP": 3773,
    "YQ": 169,
    "YR": 2713,
    "YS": 11159,
    "YT": 15210,
    "YU": 1608,
    "YV": 728,
    "YW": 8758,
    "YX": 1,
    "YY": 1499,
    "YZ": 16,
    "ZA": 75,
    "ZB": 15,
    "ZC": 17,
    "ZD": 10,
    "ZE": 2,
    "ZF": 3,
    "ZG": 1,
    "ZH": 18,
    "ZI": 7,
    "ZK": 7,
    "ZL": 1,
    "ZM": 2,
    "ZO": 10,
    "ZP": 2,
    "ZR": 2,
    "ZS": 25,
    "ZT": 59,
    "ZU": 3,
    "ZW": 27,
    "ZY": 1,
    "ZZ": 1
  },
  "provenance": {
    "input_data_sha256": "795ac2bd3e8b3c841c3c83a7ee6612534cc32d3ea486cec67a6bb0b275055996",